{
  "version": "1.0",
  "reference_id": "native-content",
  "source": {
    "url": "https://www.nativecontent.com/",
    "discovery_source": "https://curated.design/sites/s/4183/",
    "captured_at": "2026-09-05T01:09:47.673Z",
    "baseline_kind": "live-browser",
    "visual_state_policy": "runtime"
  },
  "capture": {
    "visual_state_policy": "runtime",
    "viewports": [
      {
        "width": 1440,
        "height": 900
      },
      {
        "width": 768,
        "height": 1024
      },
      {
        "width": 390,
        "height": 844
      }
    ],
    "states": [
      {
        "id": "desktop-initial",
        "kind": "initial",
        "ratio": 0,
        "screenshot": "evidence/desktop-initial.png",
        "original_screenshot": "evidence/desktop-initial.png",
        "reconstruction_screenshot": null
      },
      {
        "id": "desktop-scroll-25",
        "kind": "scroll",
        "ratio": 0.25,
        "screenshot": "evidence/desktop-scroll-25.png",
        "original_screenshot": "evidence/desktop-scroll-25.png",
        "reconstruction_screenshot": null
      },
      {
        "id": "desktop-scroll-50",
        "kind": "scroll",
        "ratio": 0.5,
        "screenshot": "evidence/desktop-scroll-50.png",
        "original_screenshot": "evidence/desktop-scroll-50.png",
        "reconstruction_screenshot": null
      },
      {
        "id": "desktop-scroll-75",
        "kind": "scroll",
        "ratio": 0.75,
        "screenshot": "evidence/desktop-scroll-75.png",
        "original_screenshot": "evidence/desktop-scroll-75.png",
        "reconstruction_screenshot": null
      },
      {
        "id": "tablet-initial",
        "kind": "initial",
        "ratio": 0,
        "screenshot": "evidence/tablet-initial.png",
        "original_screenshot": "evidence/tablet-initial.png",
        "reconstruction_screenshot": null
      },
      {
        "id": "tablet-scroll-50",
        "kind": "scroll",
        "ratio": 0.5,
        "screenshot": "evidence/tablet-scroll-50.png",
        "original_screenshot": "evidence/tablet-scroll-50.png",
        "reconstruction_screenshot": null
      },
      {
        "id": "mobile-initial",
        "kind": "initial",
        "ratio": 0,
        "screenshot": "evidence/mobile-initial.png",
        "original_screenshot": "evidence/mobile-initial.png",
        "reconstruction_screenshot": null
      },
      {
        "id": "mobile-scroll-50",
        "kind": "scroll",
        "ratio": 0.5,
        "screenshot": "evidence/mobile-scroll-50.png",
        "original_screenshot": "evidence/mobile-scroll-50.png",
        "reconstruction_screenshot": null
      }
    ],
    "dom": {
      "path": "evidence/hydrated.html",
      "sha256": "78800d8ed7e14d2f8dc6239d8b9669ff8cd7ac99f9e17eb8a541dbd572ecb74e",
      "element_count": 176
    },
    "styles_geometry": {
      "path": "evidence/capture.json",
      "element_count": 176
    },
    "fonts": [
      {
        "family": "MonumentGrotesk",
        "style": "normal",
        "weight": "400",
        "stretch": "normal",
        "status": "loaded"
      },
      {
        "family": "MonumentGrotesk",
        "style": "normal",
        "weight": "700",
        "stretch": "normal",
        "status": "loaded"
      },
      {
        "family": "MonumentGrotesk Fallback",
        "style": "normal",
        "weight": "normal",
        "stretch": "normal",
        "status": "unloaded"
      },
      {
        "family": "SuisseIntl",
        "style": "normal",
        "weight": "700",
        "stretch": "normal",
        "status": "loaded"
      },
      {
        "family": "SuisseIntl Fallback",
        "style": "normal",
        "weight": "normal",
        "stretch": "normal",
        "status": "unloaded"
      }
    ],
    "assets": [
      {
        "type": "image",
        "src": "https://www.nativecontent.com/icons/arrow-right-grayMedium.svg",
        "width": 0,
        "height": 0,
        "alt": "external arrow"
      },
      {
        "type": "image",
        "src": "https://www.nativecontent.com/icons/arrow-right-grayMedium.svg",
        "width": 0,
        "height": 0,
        "alt": "external arrow"
      },
      {
        "type": "image",
        "src": "https://www.nativecontent.com/icons/arrow-right-white.svg",
        "width": 185,
        "height": 150,
        "alt": "external arrow"
      },
      {
        "type": "image",
        "src": "https://www.nativecontent.com/icons/arrow-right-blue.svg",
        "width": 0,
        "height": 0,
        "alt": "external arrow"
      },
      {
        "type": "image",
        "src": "https://www.nativecontent.com/icons/arrow-right-white.svg",
        "width": 185,
        "height": 150,
        "alt": "external arrow"
      },
      {
        "type": "image",
        "src": "https://www.nativecontent.com/icons/arrow-right-blue.svg",
        "width": 0,
        "height": 0,
        "alt": "external arrow"
      }
    ],
    "dependencies": [
      {
        "type": "stylesheet",
        "url": "https://www.nativecontent.com/_next/static/css/d12adf2e0ac1ed9e.css?dpl=dpl_J1JS7qy8tNKv43BYPVp22N8MvUam"
      },
      {
        "type": "stylesheet",
        "url": "https://www.nativecontent.com/_next/static/css/22ab38c759632582.css?dpl=dpl_J1JS7qy8tNKv43BYPVp22N8MvUam"
      },
      {
        "type": "script",
        "url": "https://www.nativecontent.com/_next/static/chunks/94f53f20-608f2eaf898dd239.js?dpl=dpl_J1JS7qy8tNKv43BYPVp22N8MvUam"
      },
      {
        "type": "script",
        "url": "https://www.nativecontent.com/_next/static/chunks/15-00788615d2de8b32.js?dpl=dpl_J1JS7qy8tNKv43BYPVp22N8MvUam"
      },
      {
        "type": "script",
        "url": "https://www.nativecontent.com/_next/static/chunks/main-app-abbebffbded6cc7a.js?dpl=dpl_J1JS7qy8tNKv43BYPVp22N8MvUam"
      },
      {
        "type": "script",
        "url": "https://www.nativecontent.com/_next/static/chunks/560-3fbcaa9da096943f.js?dpl=dpl_J1JS7qy8tNKv43BYPVp22N8MvUam"
      },
      {
        "type": "script",
        "url": "https://www.nativecontent.com/_next/static/chunks/95-fd83549ea0b8210c.js?dpl=dpl_J1JS7qy8tNKv43BYPVp22N8MvUam"
      },
      {
        "type": "script",
        "url": "https://www.nativecontent.com/_next/static/chunks/106-06ad1d918e086113.js?dpl=dpl_J1JS7qy8tNKv43BYPVp22N8MvUam"
      },
      {
        "type": "script",
        "url": "https://www.nativecontent.com/_next/static/chunks/943-9f93f591924d4ec3.js?dpl=dpl_J1JS7qy8tNKv43BYPVp22N8MvUam"
      },
      {
        "type": "script",
        "url": "https://www.nativecontent.com/_next/static/chunks/app/(pages)/(home)/page-3e427583ad687545.js?dpl=dpl_J1JS7qy8tNKv43BYPVp22N8MvUam"
      },
      {
        "type": "script",
        "url": "https://www.nativecontent.com/_next/static/chunks/847-b34a952095a31e79.js?dpl=dpl_J1JS7qy8tNKv43BYPVp22N8MvUam"
      },
      {
        "type": "script",
        "url": "https://www.nativecontent.com/_next/static/chunks/399-b20a60ad22fd26d6.js?dpl=dpl_J1JS7qy8tNKv43BYPVp22N8MvUam"
      },
      {
        "type": "script",
        "url": "https://www.nativecontent.com/_next/static/chunks/app/layout-3f6cdb7906fef589.js?dpl=dpl_J1JS7qy8tNKv43BYPVp22N8MvUam"
      },
      {
        "type": "script",
        "url": "https://www.nativecontent.com/_next/static/chunks/polyfills-42372ed130431b0a.js?dpl=dpl_J1JS7qy8tNKv43BYPVp22N8MvUam"
      },
      {
        "type": "script",
        "url": "https://www.gstatic.com/cv/js/sender/v1/cast_sender.js?loadCastFramework=1"
      },
      {
        "type": "script",
        "url": "https://www.gstatic.com/cast/sdk/libs/sender/1.0/cast_framework.js"
      },
      {
        "type": "script",
        "url": "https://www.gstatic.com/eureka/clank/152/cast_sender.js"
      },
      {
        "type": "script",
        "url": "https://www.nativecontent.com/_next/static/chunks/webpack-6b1621df169ca1fd.js?dpl=dpl_J1JS7qy8tNKv43BYPVp22N8MvUam"
      }
    ],
    "network": [
      {
        "name": "https://www.nativecontent.com/_next/static/media/8060a6715a238ab2-s.p.woff2",
        "initiatorType": "link",
        "duration": 0,
        "transferSize": 0,
        "decodedBodySize": 18700
      },
      {
        "name": "https://www.nativecontent.com/_next/static/media/9ca7701bd809359c-s.p.woff2",
        "initiatorType": "link",
        "duration": 0,
        "transferSize": 0,
        "decodedBodySize": 18292
      },
      {
        "name": "https://www.nativecontent.com/_next/static/media/e1b399e75c1df2d8-s.p.woff2",
        "initiatorType": "link",
        "duration": 0,
        "transferSize": 0,
        "decodedBodySize": 15824
      },
      {
        "name": "https://www.nativecontent.com/_next/static/css/d12adf2e0ac1ed9e.css?dpl=dpl_J1JS7qy8tNKv43BYPVp22N8MvUam",
        "initiatorType": "link",
        "duration": 0,
        "transferSize": 0,
        "decodedBodySize": 18685
      },
      {
        "name": "https://www.nativecontent.com/_next/static/css/22ab38c759632582.css?dpl=dpl_J1JS7qy8tNKv43BYPVp22N8MvUam",
        "initiatorType": "link",
        "duration": 0,
        "transferSize": 0,
        "decodedBodySize": 1757
      },
      {
        "name": "https://www.nativecontent.com/_next/static/chunks/webpack-6b1621df169ca1fd.js?dpl=dpl_J1JS7qy8tNKv43BYPVp22N8MvUam",
        "initiatorType": "link",
        "duration": 0,
        "transferSize": 0,
        "decodedBodySize": 3975
      },
      {
        "name": "https://www.nativecontent.com/_next/static/chunks/94f53f20-608f2eaf898dd239.js?dpl=dpl_J1JS7qy8tNKv43BYPVp22N8MvUam",
        "initiatorType": "script",
        "duration": 0,
        "transferSize": 0,
        "decodedBodySize": 173017
      },
      {
        "name": "https://www.nativecontent.com/_next/static/chunks/15-00788615d2de8b32.js?dpl=dpl_J1JS7qy8tNKv43BYPVp22N8MvUam",
        "initiatorType": "script",
        "duration": 0,
        "transferSize": 0,
        "decodedBodySize": 172970
      },